{"schema_version":"1.0.0","case_id":"case-demo-20260927","network":"bitcoin-regtest","observation_id":"obs-demo-001","txid":"1111111111111111111111111111111111111111111111111111111111111111","observer_id":"observer-demo-a","src_ip":"198.51.100.7","dst_ip":"198.51.100.9","src_port":8333,"dst_port":8333,"endpoint_ip":"198.51.100.7","endpoint_port":8333,"direction":"seen_from","geo_country":"ZZ","asn":"AS64500","observer_received_at":"2026-01-01T00:00:03Z","observer_time_original":"2026-01-01T00:00:03Z","clock_quality":"estimated","capture_scope":"synthetic relay observation; no origin/ownership claim","source_refs":[{"evidence_id":"ev-demo-transactions","source_sha256":"0000000000000000000000000000000000000000000000000000000000000000","locator_type":"synthetic","locator":"network_observation:0","byte_start":null,"byte_end":null}]}
